{
  "schema": 2,
  "node_id": "node-kitchen",
  "session_id": 381245,
  "sequence_number": 44,
  "sensor_type": "PIR",
  "event_type": "MOTION",
  "location": "Kitchen",
  "monotonic_ms": 845321,
  "occurred_at": 1789108200,
  "time_uncertainty_ms": 1500,
  "battery_mv": 3780,
  "rssi_dbm": -62,
  "is_test": false,
  "payload": {}
}
